{
  "schema_version": "ulisdoq-candidate-profile-package/0.1",
  "profile": {
    "profile_id": "ULISDOQ-PROFILE-GED04-MOTORCYCLE-INSURANCE-SPECIAL-TERMS-CANDIDATE",
    "profile_version": "0.1.0",
    "family": "motorcycle_insurance_special_terms",
    "profile_path": "experiments/administration-droits/GED-04/profiles/motorcycle_insurance_special_terms_candidate.json"
  },
  "builder": {
    "profile_builder_version": "0.1.1-candidate",
    "ged_core_machine_version": "0.1.0-candidate",
    "capability_set_version": "0.1.0-candidate"
  },
  "source_plan": {
    "type": "DOCUMENTARY_INSTRUCTION_DERIVED_CANDIDATE",
    "consumer_request_id": "ULISDOQ-REQ-GEDREAL-20261024T213000Z-001",
    "instruction_result_version": 2,
    "instruction_result_commit": "2588c9f8765ebbbc0c1e1166d58b756f4597cc40",
    "planner_reexecuted": false
  },
  "tests": [
    {
      "id": "GED04-T1",
      "purpose": "Independent same-family extraction replay",
      "status": "PENDING_REQUIRED_FOR_REUSE"
    },
    {
      "id": "GED04-T2",
      "purpose": "Meaningful negative family-recognition specimen",
      "status": "PENDING_REQUIRED_BEFORE_RECOGNITION_CLAIM"
    },
    {
      "id": "GED04-T3",
      "purpose": "Field-level provenance and UNKNOWN semantics",
      "status": "SPECIFIED_NOT_EXECUTED"
    }
  ],
  "evidence": [
    "consumer-escalation/results/ULISDOQ-REQ-GEDREAL-20261024T213000Z-001/result.json",
    "experiments/factures/GED-01/profiles/sfr_structural_v0_1.json",
    "experiments/impots-finances/GED-02/profiles/fr_formulaire_2044_candidate.json",
    "experiments/administration-droits/GED-03/profiles/eml_candidate.json",
    "profile-builder/registry/CAPABILITY_REGISTRY_V0_1.json"
  ],
  "limits": [
    "Constructed from one real private specimen; private values are not included.",
    "Candidate field semantics and extraction grammar are instructed but not yet replayed on an independent same-family specimen.",
    "Recognition is not qualified and no visual matcher reference is bound.",
    "Hybrid native-text/render fallback is specified but no stable generic application currently implements the complete strategy.",
    "No production qualification."
  ],
  "debts": [
    "Implement or bind HYBRID_PDF_FIELD_EXTRACTION_WITH_TARGETED_RENDER_FALLBACK as a stable generic application.",
    "Replay candidate grammar on one independent same-family specimen.",
    "Qualify family recognition separately before enabling automatic profile selection."
  ],
  "qualification_status": "CANDIDATE_UNQUALIFIED"
}
